"135"; "12566"; "Petitfee Гидрогелевые патчи для кожи вокруг глаз Gold Hydrogel Eye Patch "; "767"; "1074"; "8809239803596"; "Petitfee"; "Гидрогелевые золотые патчи с жемчужной пудрой мгновенно приведут в тонус кожу вокруг глаз любой усталости. Благодаря плотному прилеганию патчей, активные компоненты глубоко проникают в клетки кожи и естественным образом поглощаются. Патчи имеют широкую форму, позволяя захватывать большой участок кожи под глазами с темными кругами у внутреннего угла глаза и с «гусиными лапками» у внешнего. Патчи имеют концентрированный состав активных ингредиентов, таких как аденозин для анти-эйдж эффекта, коллаген для лифтинга и натуральные экстракты камелии, розы, алоэ, монарды, лаванды, розмарина – для антисептического, противовоспалительного, антиоксидантного, омолаживающего действия. Рекомендуется для проблемной кожи вокруг глаз: с отеками, с темными кругами и «гусиными лапками». Способ применения: снимите прозрачную пленку и приложите на зону вокруг глаз. Через 20-30 минут удалите маску."; "110"; "https://beautyty.org/wp-content/uploads/2019/01/8809239803596.jpg";"0";"None";"60"
"136"; "12572"; "Secret Key Омолаживающий крем с коллоидным золотом 24K Gold Premium First Cream"; "994"; "1392"; "8809305994906"; "Secret Key"; "Питательный омолаживающий крем премиум-класса, с микрочастицами золота, мгновенно преображает и восстанавливает сухую, увядающую, зрелую и обезвоженную кожу, помогает остановить процессы  старения и вернуть коже первозданную молодость и красоту. Золото выступает в роли проводника, позволяя активным компонентам намного быстрей проникать в глубокие слои эпителия, усиливает процесс регенерации и микроциркуляции, обладает мощным антиоксидантным действием, тормозит процесс увядания. EGF улучшает тон и текстуру кожи, разглаживая морщины и осветляя пигментацию. Также в составе: сквалан, масла ши, жожоба, мурумуру, макадамии, арганы и сладкого миндаля, экстракты жимолости японской, икры, маточного молочка, босвелии, фитостволовые клетки томата и винограда, гидролизованный коллаген, ниацинамид, аденозин, гиалуроновая кислота,Способ применения: нанесите крем на очищенную  и тонизированную кожу."; "100"; "https://beautyty.org/wp-content/uploads/2019/01/8809305994906.jpg";"0";"None";"50"
"137"; "12574"; "Secret Key Омолаживающая эссенция с коллоидным золотом 24K Gold Premium First Essence "; "1075"; "1506"; "8809305994661"; "Secret Key"; "Антивозрастная эссенция премиум-класса с коллоидным золотом оказывает многофункциональное действие на кожу, увлажняет и осветляет ее, сокращает количество и глубину морщин. Золото выступает в роли проводника, позволяя активным компонентам намного быстрей проникать в глубокие слои эпителия, усиливает процесс регенерации и микроциркуляции, обладает мощным антиоксидантным действием, тормозит процесс увядания. EGF стимулирует процессы восстановления, клеточного обновления, улучшая тон и текстуру кожи,  возвращает первоначальную упругость и эластичность, устраняет проявления пигментации. Также в составе: экстракты жимолости японской, икры, маточного молочка, босвелии, фитостволовые клетки томата и винограда, гидролизованный коллаген, ниацинамид, аденозин, гиалуроновая кислота,Способ применения: нанесите эссенцию на очищенную  и тонизированную кожу лица, шеи и области декольте. "; "200"; "https://beautyty.org/wp-content/uploads/2019/01/8809305994661.jpg";"0";"None";"150"
"138"; "12576"; "Secret Key Омолаживающая сыворотка с коллоидным золотом 24K Gold Premium First Serum"; "1034"; "1447"; "8809305994890"; "Secret Key"; "Высокоэффективная сыворотка премиум-класса, с микрочастицами золота, мгновенно преображает и восстанавливает сухую, увядающую, зрелую и обезвоженную кожу, помогает остановить процессы  старения и вернуть коже первозданную молодость и красоту. Золото выступает в роли проводника, позволяя активным компонентам намного быстрей проникать в глубокие слои эпителия, усиливает процесс регенерации и микроциркуляции, обладает мощным антиоксидантным действием, тормозит процесс увядания. EGF стимулирует процессы восстановления, клеточного обновления, улучшая тон и текстуру кожи, возвращает первоначальную упругость и эластичность, устраняет проявления пигментации. Также в составе: экстракты жимолости японской, икры, маточного молочка, босвелии, фитостволовые клетки томата и винограда, гидролизованный коллаген, ниацинамид, аденозин, гиалуроновая кислота,Способ применения: нанесите эссенцию на очищенную  и тонизированную кожу лица, шеи и области декольте. "; "80"; "https://beautyty.org/wp-content/uploads/2019/01/8809305994890.jpg";"0";"None";"30"
"139"; "2760"; "Secret Key Маска-пленка для очищения и сужения пор Black Out Pore Peel-Off Pack"; "744"; "1042"; "8809305997549"; "Secret Key"; "Производитель: «ZENPIA Co. Ltd.», Южная Корея, 301, Muhak Building, 17-6, Jamwon-dong, Seocho-gu.  Пенящаяся маска, позволяющая очистить поры, делая поверхность лица гладкой и светлой. Маска содержит экстракт чёрного угля, который впитывается в поры и вытягивает за собой черные точки, грязь и кожное сало из пор. Способ применения: 
На чистое лицо равномерно нанести маску. Подождать от 3 до 5 минут пока она не вспенится. После того как маска вспенилась, мягкими движениями помассажировать лицо, позволяя маске очистить кожу от черных точек. Смыть маску водой."; "150"; "http://localhost/wp/wp-content/uploads/2019/01/8809305999345.jpg";"0";"None";"100"
"140"; "12582"; "Secret Key Крем для лица с муцином черной улитки Black Snail Original Cream"; "910"; "1275"; "8809305995057"; "Secret Key"; "Многофункциональный крем с муцином черной улитки питает и увлажняет, предотвращает преждевременное старение, улучшает цвет лица, повышает иммунитет и защищает кожу от вредного воздействия внешней среды. Экстракт муцина черной африканской улитки (45000mg) -  мощный антиоксидант, защищает клетки от преждевременного старения, улучшает микроциркуляцию, укрепляет стенки сосудов, выравнивает цвет лица и рассасывает застойные пятна. Восстанавливает качество коллагеновых волокон, омолаживает и подтягивает кожу. Также в составе: ниацинамид, масла оливы и ши, экстракты мёда, гинкго билоба, дягиля, пиона, ламинарии японской, граната, солодки, полыни, дрожжей и босвеллии. Способ применения: на очищенную кожу нанесите крем и дайте впитаться. Подходит для ежедневного использования утром и вечером."; "100"; "https://beautyty.org/wp-content/uploads/2019/01/8809305995057.jpg";"0";"None";"50"
"141"; "12586"; "Secret Key Патчи для кожи вокруг глаз с золотом Gold Premium First Eye Patch "; "1034"; "1447"; "8809305999192"; "Secret Key"; "Гидрогелевые патчи увлажняют и питают кожу вокруг глаз, возвращают ей упругость, оживляют уставшую и тусклую кожу, разглаживают морщины, устраняют отечность и темные круги под глазами, делают кожу нежной, гладкой и сияющей. Золото способствует быстрому проникновению в кожу молекул кислорода, что необходимо для ее восстановления и омоложения, усиливает циркуляцию крови, выводит токсины и шлаки. Патчи обладают великолепным регенерирующим, противовоспалительным и антиоксидантным действием, защищают от агрессивного влияния факторов окружающей среды. Патчи можно использовать и на область носогубных складок.
Способ применения: приложить патчи на очищенную кожу области вокруг глаз. Через 30-40 минут снять, а остатки эссенции распределить по коже."; "110"; "https://beautyty.org/wp-content/uploads/2019/01/8809305999192.jpg";"0";"None";"60"
"142"; "2840"; "Secret Key Гидрофильное масло с экстрактом лимона Lemon Sparkling Cleansing Oil "; "704"; "985"; "8809305999802"; "Secret Key"; "Производитель: «ZENPIA Co. Ltd.», Южная Корея, 301, Muhak Building, 17-6, Jamwon-dong, Seocho-gu.   Масло создано на основе экстракта лимона и газированной воды, содержит виноградное, оливковое масло, масла соевых бобов. Эффективно растворяет загрязнения в порах, черные точки, комедоны, мягко очищает кожу даже от самого стойкого макияжа, ВВ и СС кремов.
Применение: Нанести на сухую кожу лица, помассировать кожу 1-2 минуты, затем смочить ладони теплой водой и повторно помассировать лицо до превращения масла в эмульсию, которая растворяет макияж. Смыть теплой водой.
Объем: 150мл"; "200"; "http://localhost/wp/wp-content/uploads/2019/01/8809305996252.jpg";"0";"None";"150"
"143"; "2838"; "Secret Key Ватные диски с экстрактом лимона и салициловой кислотой Lemon Sparkling Peeling Pad "; "855"; "1198"; "8809305999826"; "Secret Key"; ""; "120"; "http://localhost/wp/wp-content/uploads/2019/01/2000763423571.jpg";"0";"None";"70"
"144"; "12596"; "Secret Key Крем для лица с лошадиным жиром MaYu Healing Facial Cream "; "910"; "1275"; "8809305995262"; "Secret Key"; "Крем для лица с лошадиным жиром предназначен для глубокого питания и увлажнения сухой, поврежденной, обезвоженной или увядающей кожи. Лошадиный жир ускоряет регенерацию, улучшает защитный барьер кожи, смягчает, разглаживает морщины и выравнивает рельеф кожи. В состав крема входят также аденозин, ниацинамид, масло ши, масло облепихи, экстракт пивных дрожжей, экстракт меда, экстракт ламинарии и другие питательные компоненты, необходимые для здоровья кожи. Благодаря крему, кожа улучшается в целом, становится более ровной и гладкой, бархатистой и нежной, а ее цвет выравнивается. Способ применения: после очищения и тонизирвания, нанести небольшое количество крема массажными движениями."; "120"; "https://beautyty.org/wp-content/uploads/2019/01/8809305995262.jpg";"0";"None";"70"
"145"; "12602"; "Secret Key Восстанавливающая ночная сыворотка с фитостволовыми клетками Multi Cell Night Repair Ampoule"; "869"; "1216"; "8809305991813"; "Secret Key"; "Высококонцентрированная сыворотка ночного действия эффективно восстанавливает плотность, упругость и эластичность увядающей и зрелой кожи. Комплекс фитостволовых клеток винограда, томата и зеленого чая оказывают активное омолаживающее и антиоксидантное действие, стимулируют процессы регенерации и синтеза собственного коллагена, разглаживают микрорельеф, смягчают, успокаивают и тонизируют кожу. Ферментированный лизат бифидобактерий стимулирует обновление клеток, нормализует гидробаланс, устраняет дряблость кожи и тусклость тона. Аденозин, арбутин и ниацинамид благотворно влияют на сухую и зрелую кожу, заметно преображая ее в кратчайший  срок, осветляют пигментацию различного происхождения, устраняют заломы и морщины, повышают плотность кожи.Способ применения: нанесите эссенцию на очищенную  и тонизированную кожу лица, шеи и области декольте. "; "100"; "https://beautyty.org/wp-content/uploads/2019/01/8809305991813.jpg";"0";"None";"50"
"146"; "12604"; "Secret Key Гидрогелевые патчи для глаз и щек Pink Racoony Hydro-Gel Eye & Cheek Patch "; "951"; "1332"; "8809305998751"; "Secret Key"; "Невероятно нежные патчи, с экстрактом розы, увлажняют и успокаивают раздраженную кожу, охлаждают ее, питают, разглаживают и осветляют, повышают тонус и эластичность. Розовая вода - обладает мощным антивозрастным действием, возвращает коже упругость и эластичность, делает её гладкой и свежей, придает тонус безжизненной коже, разглаживает морщинки, регенерирует, устраняет воспалительные реакции, укрепляет, уменьшает гиперемию и купероз. Золото – проводник для молекул кислорода, усиливает циркуляцию крови, выводит токсины и шлаки. Патчи, в форме сердечек, могут использоваться для кожи под глазами, в области носогубных складок, на щекахСпособ применения: на очищенную кожу приложить патчи и оставить их на 20-30 минут, затем снять, а остатки эссенции распределить."; "110"; "https://beautyty.org/wp-content/uploads/2019/01/8809305998751.jpg";"0";"None";"60"
"147"; "12608"; "Secret Key Восстанавливающий тонер с экстрактом розы Rose Water Base Toner"; "744"; "1042"; "8809305999994"; "Secret Key"; "Универсальный тонер, с невероятным ароматом розы, оказывает активное восстанавливающее и оздоравливающее действие, увлажняет, успокаивает, освежает и тонизирует кожу, устраняет сухость и шелушения, способствует поддержанию оптимального гидробаланса, улучшает клеточное дыхание и ускоряет регенерацию кожи. Гидролат и экстракт розы сентифолия смягчают и увлажняют кожу, успокаивают ее, ускоряя заживление, замедляют процессы старения, повышая уровень эластичности и упругости, делают мягкой и нежной, устраняют тусклый и неровный тон. Также в составе: пантенол, мочевина, гиалуроновая кислота, экстракты листьев алоэ и босвелии.  Способ применения: нанесите тонер на очищенную кожу."; "600"; "https://beautyty.org/wp-content/uploads/2019/01/8809305999994.jpg";"0";"None";"550"
"148"; "12624"; "Secret Key Маска для лица Snow White Milky Pack "; "704"; "985"; "8809305995989"; "Secret Key"; "Осветляющая маска предназначена для тусклой кожи, а также для кожи с излишней пигментацией. Ниацинамид эффективно борется с пигментацией различного происхождения, помогает коже вырабатывать собственные липиды и кожные церамиды, ускоряет синтез коллагена, регулирует выработку кожного жира, защищает от негативного воздействия окружающей среды. Кожа становится светлее, мягче, приобретает эластичность. Молочные протеины - питают и увлажняют, омолаживают и регенирируют клетки кожи. Бетаин - увлажняет кожу, защищает её от потери влаги, устраняет шелушения. Маска осветляет кожу, делает её ровной, гладкой, упругой. Защищает от покраснений и раздражений, а также заметно сужает расширенные поры.Способ применения: нанести маску на очищенную кожу на 2-3 минуты, затем смыть. Для усиления эффекта, можно кожу обработать скрабом или пилингом."; "250"; "https://beautyty.org/wp-content/uploads/2019/01/8809305995989.jpg";"0";"None";"200"
"149"; "2986"; "Secret Key Бальзам для волос So Fast Hair Booster Treatment "; "704"; "985"; "8809305994241"; "Secret Key"; "Производитель: «ZENPIA Co. Ltd.», Южная Корея, 301, Muhak Building, 17-6, Jamwon-dong, Seocho-gu.  
Данный кондиционер-маска поможет восстановить Ваши волосы и придать им желанный блеск и красоту. Средство базируется на экстракте черного риса, кунжута и черных бобов. Кондиционер питает волосы, предотвращает ломкость и контролирует водный баланс кожи головы.
Использование: используйте, как кондиционер. Нанесите немного средства после использования шампуня на всю длину волос и смойте теплой водой водой через 3-4 минуты. Используйте, как маску: нанесите средство по всей длине волос и оставьте на 20 минут. После этого, смойте средство теплой водой и в самом конце, ополосните волосы прохладной водой, чтобы придать им дополнительный блеск.
Объем: 360мл"; "410"; "http://localhost/wp/wp-content/uploads/2019/01/8809305994241.jpg";"0";"None";"360"
"150"; "3018"; "Secret Key Увлажняющая эссенция с экстрактом галактомисиса Starting Treatment Essence"; "1075"; "1506"; "8809305991295"; "Secret Key"; "Производитель: «ZENPIA Co. Ltd.», Южная Корея, 301, Muhak Building, 17-6, Jamwon-dong, Seocho-gu.  
Эмульсия на основе молочных культур, эффективно увлажняет кожу лица, а также оказывает осветляющее действие.
Фолиевая кислота, ниацин и витамины группы B, питают кожу и улучшают её эластичность. Средство оказывает антиоксидантное действие, защищая кожу от негативного воздействия окружающей среды и предотвращая преждевременное старение.
Эмульсия моментально впитывается и, проникая в каждую клеточку кожи, питает её, регулирует pH баланс кожи, а также выработку кожного жира. Регулярное применение позволяет коже выглядеть ухоженной, увлажненной, молодой.
В эмульсии не содержатся парабены, минеральные масла, продукты животного происхождения, а также искусственные красители.
Способ применения: нанести на очищенную кожу лица, дать впитаться.
Объем: 155мл"; "205"; "http://localhost/wp/wp-content/uploads/2019/01/8809305991295.jpg";"0";"None";"155"
