"81"; "12408"; "IT'S SKIN Высококонцентрированная сыворотка с пептидом змеиного яда Power 10 Formula SYN-AKE"; "928"; "1299"; "8809241887911"; "It'S SKIN"; "Омолаживающая высококонцентрированная сыворотка, с активным миорелаксирующим и лифтинг действием, эффективно сокращает количество и глубину морщин, создавая эффект ботокса, выравнивает тон, устраняя пигментацию различного происхождения, освежает тусклую и увядающую кожу. Синтезированный змеиный пептид Syn-Ake оказывает действие, подобное ботоксу, эффективно борется с процессами старения, укрепляет структуру кожи, разглаживает морщины и выравнивает тон. Лизат лактобактерий и лизат сахаромисес обогащены натуральными пробиотиками, которые оказывают противовоспалительное и антибактериальное действие, активизируют обменные процессы и укрепляют стенки сосудов.Способ применения: нанесите сыворотку на очищенную и тонизированную кожу. "; "80"; "https://beautyty.org/wp-content/uploads/2019/01/8809241887911.jpg";"0";"None";"30"
"82"; "12412"; "IYOUB Гидрогелевые патчи с экстрактом ласточкиного гнезда Hydrogel Eye Patch Bird's Nest"; "778"; "1090"; "8809524610243"; "IYOUB"; "Гидрогелевые патчи c экстрактом ласточкиного гнезда оказывают интенсивное омолаживающее действие, эффективно устраняя мимические морщины. Действуя на клеточном уровне, патчи интенсивно увлажняют кожу и запускают процессы ее регенерации, повышают упругость и эластичность, подтягивают кожу, разглаживают морщины, осветляют и выравнивают тон, избавляют от токсинов. Экстракт ласточкиного гнезда омолаживает кожу, делает ее значительно более упругой, подтянутой и эластичной. Гиалуроновая кислота увлажняет кожу и препятствует обезвоживанию. Мельчайшие частицы бриллиантовой пудры придают коже свежесть и естественное сияние. Березовый сок увлажняет, тонизирует и осветляет пигментацию.Патчи также могут быть использованы в борьбе с носогубными и межбровными морщинками. Эти патчи подойдут обладательницам самой чувствительной кожи.Способ применения: приложите патчи на очищенную кожу в области под глазами. Через 20-30 минут патчи снимите, а остатки эссенции аккуратно распределите по коже и дайте полностью впитаться."; "110"; "https://beautyty.org/wp-content/uploads/2019/01/8809524610243.jpg";"0";"None";"60"
"83"; "12414"; "IYOUB Гидрогелевые патчи с черным жемчугом Hydrogel Eye Patch Black Pearl "; "778"; "1090"; "8809524610007"; "IYOUB"; "Гидрогелевые патчи для кожи вокруг глаз c черным жемчугом оказывают интенсивное омолаживающее действие, эффективно устраняя мимические морщины. Действуя на клеточном уровне, патчи интенсивно увлажняют кожу и запускают процессы ее регенерации, повышают упругость и эластичность, подтягивают кожу, разглаживают морщины, осветляют и выравнивают тон, избавляют от токсинов. Пудра черного жемчуга насыщает кожу 20 полезными минералами, витаминами и аминокислотами, ускоряет обновление клеток кожи, восстанавливает и омолаживает ее. Гиалуроновая кислота увлажняет кожу и препятствует обезвоживанию. Бетаин активно увлажняет, снимает раздражение и уменьшает отечность.Патчи также могут быть использованы в борьбе с носогубными  и межбровными морщинками.Способ применения: приложите патчи на очищенную кожу в области под глазами. Через 20-30 минут патчи снимите, а остатки эссенции аккуратно распределите по коже и дайте полностью впитаться."; "110"; "https://beautyty.org/wp-content/uploads/2019/01/8809524610007.jpg";"0";"None";"60"
"84"; "12416"; "IYOUB Гидрогелевые патчи с золотом Hydrogel Eye Patch Gold"; "778"; "1090"; "8809524610014"; "IYOUB"; "Патчи, пропитанные высококонцентрированной эссенцией, оказывают интенсивное омолаживающее действие, эффективно устраняя мимические морщины. Действуя на клеточном уровне, патчи интенсивно увлажняют кожу и запускают процессы ее регенерации, повышают упругость и эластичность, подтягивают кожу, разглаживают морщины, осветляют и выравнивают тон, избавляют от токсинов. 24-каратное коллоидное золото стимулирует микроциркуляцию крови, выработку коллагена и эластина, ускоряет регенерацию, способствует поддержанию оптимальной увлажненности кожи, что в свою очередь повышает упругость и эластичность кожи, укрепляет и подтягивает ее. Аллатонин способствует клеточной регенерации кожи и снятию раздражений. Мельчайшие частицы бриллиантовой пудры придают коже свежесть и естественное сияние. Способ применения: приложите патчи на очищенную кожу в области под глазами. Через 20-30 минут патчи снимите, а остатки эссенции аккуратно распределите по коже и дайте полностью впитаться."; "110"; "https://beautyty.org/wp-content/uploads/2019/01/8809524610014.jpg";"0";"None";"60"
"85"; "12418"; "IYOUB Гидрогелевые патчи с морским коллагеном Hydrogel Eye Patch Marine Collagen "; "778"; "1090"; "8809524610236"; "IYOUB"; "Гидрогелевые патчи c экстрактом морского коллагена оказывают интенсивное омолаживающее действие, эффективно устраняя мимические морщины. Действуя на клеточном уровне, патчи интенсивно увлажняют кожу и запускают процессы ее регенерации, повышают упругость и эластичность, подтягивают кожу, разглаживают морщины, осветляют и выравнивают тон, избавляют от токсинов. Морской коллаген укрепляет и разглаживает структуру кожи, удерживает влагу в глубоких слоях, поддерживая оптимальный гидробаланс и защищая кожу от обезвоживания. Пудра чёрного жемчуга отшелушивает ороговевшие клетки, выводит токсины, улучшает кровообращение и стимулирует обмен веществ. Экстракт ламинарии уменьшает глубину морщин, снимает усталость, повышает тонус, восстанавливает её гладкость и эластичность. Экстракт морской капусты отбеливает кожу, выравнивая её тон, успокаивает раздражения.
Способ применения: приложите патчи на очищенную кожу в области под глазами. Через 20-30 минут патчи снимите, а остатки эссенции аккуратно распределите по коже "; "110"; "https://beautyty.org/wp-content/uploads/2019/01/8809524610236.jpg";"0";"None";"60"
"86"; "12420"; "IYOUB Гидрогелевые патчи с экстрактом розы Hydrogel Eye Patch Rose "; "778"; "1090"; "8809524610229"; "IYOUB"; "Гидрогелевые патчи c экстрактом болгарской розы оказывают интенсивное омолаживающее действие, эффективно устраняя мимические морщины. Действуя на клеточном уровне, патчи интенсивно увлажняют кожу и запускают процессы ее регенерации, повышают упругость и эластичность, подтягивают кожу, разглаживают морщины, осветляют и выравнивают тон, избавляют от токсинов. Экстракт болгарской розы увлажняет кожу, регенерирует, разглаживает мимические морщинки, повышает эластичность и успокаивает нежную кожу вокруг глаз. Рубиновая пудра интенсивно увлажняет и придаёт сияние, делая взгляд свежим и отдохнувшим. Экстракт зеленого чая успокаивает, увлажняет и снимает воспаления. Экстракт лотоса укрепляет тургор кожи, делает ее эластичной, заметно разглаживает морщины. Патчи также могут быть использованы  борьбе с носогубными и межбровными морщинками.Способ применения: приложите патчи на очищенную кожу в области под глазами. Через 20-30 минут патчи снимите, а остатки эссенции аккуратно распределите по коже  "; "110"; "https://beautyty.org/wp-content/uploads/2019/01/8809524610229.jpg";"0";"None";"60"
"87"; "12422"; "IYOUB Гидрогелевые патчи с маслом ши Hydrogel Eye Patch Shea Butter "; "778"; "1090"; "8809524610250"; "IYOUB"; "Гидрогелевые патчи для кожи вокруг глаз c маслом ши оказывают интенсивное омолаживающее действие, эффективно устраняя мимические морщины. Действуя на клеточном уровне, патчи интенсивно увлажняют кожу и запускают процессы ее регенерации, повышают упругость и эластичность, подтягивают кожу, разглаживают морщины, осветляют и выравнивают тон, избавляют от токсинов. Масло Ши - природный антиоксидант, подавляя свободные радикалы, действие ультрафиолета и старение кожи, смягчает ее, укрепляет, наполняя влагой, препятствует обезвоживанию, способствует сохранению тонуса кожи, предотвращению появления морщинок. Источник витамина Е и других микроэлементов. Гиалуроновая кислота увлажняет кожу и препятствует обезвоживанию. Пантенол успокаивает, устраняет покраснения и раздражения. Жемчужная пудра- осветляет, оказывает омолаживающее воздействие. Экстракты авокадо, грейпрфрута, мяты, камелии - смягчают, питают, восстанавливают тонус. Патчи с масло Ши рекомендованы обладательницам сухой, чувствительной кожи. "; "110"; "https://beautyty.org/wp-content/uploads/2019/01/8809524610250.jpg";"0";"None";"60"
"88"; "1606"; "La'dor Бесщелочной шампунь с коллагеном и аргановым маслом Damage Protector Acid Shampoo 900мл"; "796"; "1114"; "8809500810926"; "La'dor"; "Производитель: «LADOR Co. Ltd. .» Южная Корея 19-10, Dobong-ro 68 Gil, Gangbuk-gu, Seoul. Профессиональный шампунь с аргановым маслом, с кислотным уровнем pH 4.5, рекомендован для сухих, ослабленных и поврежденных волос. Также подходит для устранения и предотвращения появления перхоти. Он очищает волосы и способствует восстановлению волосяных чешуек. Практически не пенится, но хорошо распутывает и разглаживает волосы. Сохраняет стойкость цвета и рекомендован даже для ежедневного применения для окрашенных волос. Использование: Нанести небольшое количество шампуня на влажные волосы, помассировать 3-4мин, смыть. При необходимости повторить процедуру Объем: 900мл"; "950"; "http://localhost/wp/wp-content/uploads/2019/01/8809500810926.jpg";"0";"Water, Sodium Laureth Sulfate, Sodium Lauryl Sulfate, Cocamidopropyl Betaine, PEG-60 Hydrogenated Castor Oil, Trideceth-10, Lauramide DEA, Argania Spinosa Kernel Oil, Disodium EDTA, Polyquaternium-10, Citric Acid, Climbazole, Hydroxyacetophenone, Sodium Benzoate, CI 19140, Fragrance";"900"
"89"; "1606"; "La'dor Бесщелочной шампунь с коллагеном и аргановым маслом Damage Protector Acid Shampoo 1500ml"; "1465"; "2051"; "8809500813088"; "La'dor"; "Производитель: «LADOR Co. Ltd. .» Южная Корея 19-10, Dobong-ro 68 Gil, Gangbuk-gu, Seoul. Профессиональный шампунь с аргановым маслом, с кислотным уровнем pH 4.5, рекомендован для сухих, ослабленных и поврежденных волос. Также подходит для устранения и предотвращения появления перхоти. Он очищает волосы и способствует восстановлению волосяных чешуек. Практически не пенится, но хорошо распутывает и разглаживает волосы. Сохраняет стойкость цвета и рекомендован даже для ежедневного применения для окрашенных волос. Использование: Нанести небольшое количество шампуня на влажные волосы, помассировать 3-4мин, смыть. При необходимости повторить процедуру Объем: 900мл"; "1550"; "http://localhost/wp/wp-content/uploads/2019/01/8809500810926.jpg";"0";"Water, Sodium Laureth Sulfate, Sodium Lauryl Sulfate, Cocamidopropyl Betaine, PEG-60 Hydrogenated Castor Oil, Trideceth-10, Lauramide DEA, Argania Spinosa Kernel Oil, Disodium EDTA, Polyquaternium-10, Citric Acid, Climbazole, Hydroxyacetophenone, Sodium Benzoate, CI 19140, Fragrance";"1500"
"90"; "1604"; "La'dor Защитный кондиционер для поврежденных волос Damage Protector Acid Conditioner 900мл"; "892"; "1248"; "8809500814269"; "La'dor"; "Производитель: «LADOR Co. Ltd. .» Южная Корея 19-10, Dobong-ro 68 Gil, Gangbuk-gu, Seoul.  Защитный кондиционер для поврежденных волос Lador Damage Protector Acid Conditioner. Средство отлично защищает, укрепляет и восстанавливает кутикулу поврежденных волос. Содержит в своём составе гидролизованный шелк, который глубоко питает волосы, насыщает их силой, здоровьем и красотой. Благодаря низкой кислотности кондиционер подходит даже для самой чувствительной кожи головы. Особенно рекомендуется к применению для окрашенных волос, так как средство прекрасно защищает и усиливает цвет. Основные действующие компоненты: гидролизованный шелк, экстракт бергамота, экстракт мяты, экстракт ромашки. Способ применения: Небольшое количество кондиционера нанесите на влажные, подсушенные полотенцем волосы, а также на кожу головы. Оставьте на 1-2 минуты, смойте теплой водой. Для получения более выраженного результата используйте в паре с шампунем из этой же серии."; "950"; "http://localhost/wp/wp-content/uploads/2019/01/8809500814269.jpg";"0";"Water, Cetearyl Alcohol, Cyclopentasiloxane, Dimethicone, Glycerine, Polyquaternium-7, Behentrimonium Chloride, Steartrimonium Chloride, Amodimethicone, Glyceryl Stearate, PEG-100 Stearate, Trideceth-12, Cetrimonium Chloride, 1,2-Hexanediol, Caprylyl Glycol, Hydroxypropyltrimonium Hydrolyzed Silk, Sodium Benzoate, Lavandula Angustifolia (Lavender) Extract, Rosmarinus Officinalis (Rosemary) Extract, Thymus Vulgaris (Thyme) Extract.";"900"
"91"; "1610"; "La'dor Шампунь против выпадения волос Dermatical Hair-Loss Shampoo "; "1049"; "1469"; "8809353531924"; "La'dor"; "Производитель: «LADOR Co. Ltd. .» Южная Корея 19-10, Dobong-ro 68 Gil, Gangbuk-gu, Seoul. Средство имеет нейтральный pH баланс , особенно рекомендуется для склонной к жирности кожи головы. Благодаря входящей в состав салициловой кислоте, декспантенолу и 11 натуральных увлажняющих ингредиента  шампунь снимает зуд, подавляет работу сальных желез, оказывает противовоспалительное действие, блокирует развитие болезнетворных микроорганизмов благодаря созданию кислой среды, размягчает верхний слой эпидермиса, способствует отшелушиванию ороговевших чешуек, кроме того предупреждает выпадение волос. ё Способ применения: Нанести шампунь на влажные волосы, вспенить и помассировать, затем смыть теплой водой."; "580"; "http://localhost/wp/wp-content/uploads/2019/01/8809353531924_1.jpg";"0";"Water, Lauryl Glucoside, Decyl Glucoside, Cocodimonium Hydroxypropyl HydrolyzedWheat Protein, Polyquaternium-10, Disodium Cocoyl Glutamate, Sodium Cocoyl Glutamate, Menthol, Salicylic Acid, Panthenol, 1,2-Hexanediol, Propylene Glycol, Hyaluronic Acid, Citrus Aurantium Dulcis (Orange) Oil, Lavandula Angustifolia (Lavender) Oil, Cymbopogon Schoenanthus Oil, Abies Sibirica Oil, Amyris Balsamifera Bark Oil, Salvia Sclarea (Clary) Oil.";"530"
"92"; "1670"; "La'dor Шампунь для всей семьи Family Care Shampoo 900мл"; "1073"; "1503"; "8809500814177"; "La'dor"; "Производитель: «LADOR Co. Ltd. .» Южная Корея 19-10, Dobong-ro 68 Gil, Gangbuk-gu, Seoul. Шампунь предназначен для применения всеми членами семьи, независимо от пола и возраста.Шампунь не содержит парабены и силиконы, мягко очищает волосы и кожу головы, не оставляя и следа от всевозможных загрязнений – пыли, излишков кожного жира, отмерших клеток. Помимо превосходного очищения шампунь дарит коже головы чувство свежести и комфорта, делает волосы мягкими и блестящими. Шампунь с pH-балансом 6.5 может использоваться для ежедневного применения, гипоаллергенная формула подходит даже для самой чувствительной кожи головы.
